{
  "schema": "singular.orchestration.audit-verdict.v1",
  "taskId": "TASK-1112",
  "runId": "RUN-20260912T141057Z-91441",
  "branch": "codex/brain-rescue/TASK-1112",
  "verdict": "accepted",
  "evidenceReviewed": [
    "evidence-manifest.json",
    "Host-delivered packet.json, SHA256 1caf1317e09fe5ad16c055419c6522d54f3070df971b9163aa1089d0b9c81dfe",
    "Host-delivered audit-verification.json, SHA256 f6fbb31624bea6c0842c7b984e12407cdcb2419daf0c602fdc796143ea4d7676",
    "worker-evidence/red.log, retrieved through evidence-show.sh",
    "worker-codex.log, bounded excerpt at offset 122000",
    "Committed diff from 3543f0b36c6388dbb570ae3c2071a090e804f14d to a81f2a50dc99d5a6ae3052be61be35d2e0b6fd9c",
    "All 18 manifest file hashes and byte comparison against corrected source b84ec0deb4258f9fa896f3a33d3027a9ccfae2d4",
    "Reconciliation, diagnostic compatibility, configuration, model-conformance and dashboard regression fixtures",
    "Authoritative contract describing preserved reconciliation red/green provenance and corrected-candidate host verification",
    "schemas/orchestration/audit-verdict.v1.schema.json",
    "campaign-binding:campaign:BRAIN-RESCUE-20260910-SOL-HIGH-ASTRA-MEDIUM-A7-ONEPASS-20260912:sha256:7410de5e64f38dc6eefc9ce881c16c8fdb75cb6d9415d223f144e145762685e9:epoch:cf7e95121abf258373f8a73e123b79f131c893a18731790e",
    "reviewed-head-sha:a81f2a50dc99d5a6ae3052be61be35d2e0b6fd9c"
  ],
  "verificationResults": [
    {
      "status": "not-rerun-evidence-verified",
      "command": "SINGULAR_TEST_JOBS=2 bash tests/run.sh test-incremental-reconcile.sh test-diagnostic-compatibility.sh test-dynamic-dispatch.sh test-reconcile-low-disk.sh test-doctor-json.sh test-effective-config-parity.sh test-doctor-model-conformance.sh test-ops-health.sh test-config-loader.sh test-console-server.sh test-provider-resolver-parity.sh test-dag-evaluation-diagnostics.sh test-autonomate-progress-accounting.sh test-campaign-freeze.sh",
      "evidenceRefs": [
        "audit-verification.json",
        "evidence-manifest.json",
        "gate-check.log",
        "worker-evidence/red.log",
        "worker-evidence/regression.log"
      ],
      "rationale": "The authoritative host report binds the earlier 14/14 successful gate to committed head a81f2a50dc99d5a6ae3052be61be35d2e0b6fd9c and tree e3b01479142cb5f57f49372e2ec28ad038059bac. Independent file comparisons confirm the corrected product bytes. The fresh worker gate's registry and console sandbox limitations remain infrastructure limitations, not product findings. No tests were rerun during this audit."
    }
  ],
  "commandsRun": [
    "cat evidence-manifest.json using its supplied absolute path",
    "cat schemas/orchestration/audit-verdict.v1.schema.json",
    "git status --short; git status --porcelain",
    "git rev-parse HEAD codex/brain-integration; git rev-parse HEAD^{tree}",
    "git merge-base HEAD codex/brain-integration",
    "git diff --stat 3543f0b36c6388dbb570ae3c2071a090e804f14d HEAD",
    "git diff 3543f0b3 HEAD -- selected owned implementation and test files",
    "git diff --name-status b84ec0de HEAD",
    "git log --oneline 3543f0b36c6388dbb570ae3c2071a090e804f14d..codex/brain-integration",
    "git diff --check 3543f0b3 HEAD",
    "rg and sed searches and reads of implementation, fixtures and repository instructions",
    "evidence-show.sh <supplied-manifest> worker-evidence/red.log 2048 0",
    "evidence-show.sh <supplied-manifest> worker-codex.log 12000 122000",
    "Python read-only SHA256 and git-show byte comparisons for all 18 manifest files; successful after replacing a sandbox-denied shell heredoc with python3 -c"
  ],
  "findings": [],
  "requiredFixes": [],
  "rationale": "Accepted on source inspection and authoritative bound verification. All changed files are owned; the worktree is clean. Target drift consists only of a project-state update. The index remains discovery-only, preserves canonical eligibility and campaign checks, and has fixtures for invalidation, periodic discovery, corruption and interrupted-publication recovery. Shared diagnostics preserve configuration failure unknowns, lifecycle provenance, schema compatibility and generation-aware caches; HTTP and concurrency fixtures cover refresh behavior. Model inventory omission remains distinct from provider rejection without paid regression calls. Reused test evidence is permitted by the contract; rejected attempts remain historical evidence rather than acceptance. The manifest's secret scan was not run, and this audit does not claim otherwise. Final integration remains subject to canonical source, campaign and eligibility checks."
}
